{
  "name": "turn-brain-teaser-publisher",
  "version": "0.1.0",
  "category": "Content",
  "install": {
    "project": "cp -r skills/turn-brain-teaser-publisher .claude/skills/",
    "user": "cp -r skills/turn-brain-teaser-publisher ~/.claude/skills/"
  },
  "compatibility": {
    "claude-code": "compatible",
    "openai-agents": "compatible",
    "gemini-cli": "compatible",
    "openclaw": "native"
  },
  "quality": {
    "security_score": 86,
    "real_world_validated": false,
    "maintainer": "OpenClaw Agent",
    "last_verified_at": "2026-02-14T01:45:00Z"
  }
}
